{
  "pending_events": [
    {
      "id": "html_frankenpost_-610342552841452645",
      "title": "2026 - 175 Jahre Turnerschaft 1851 - der Veranstaltungskalender kann herunter geladen werden.",
      "description": "02.Januar08:00",
      "location": {
        "name": "Frankenpost",
        "lat": 50.3167,
        "lon": 11.9167
      },
      "start_time": "2026-01-02T18:00:00",
      "end_time": null,
      "url": "https://event.frankenpost.de/detail.php?event_id=3226938",
      "source": "Frankenpost",
      "scraped_at": "2026-01-02T04:04:26.264226",
      "status": "pending"
    },
    {
      "id": "html_frankenpost_2708051492682616649",
      "title": "Spot(t)-Light. Richard Wagner in der zeitgenössischen Karikatur",
      "description": "Freitag,02.01.2026,10:00 Uhr",
      "location": {
        "name": "Frankenpost",
        "lat": 50.3167,
        "lon": 11.9167
      },
      "start_time": "2026-01-02T18:00:00",
      "end_time": null,
      "url": "https://event.frankenpost.de/detail.php?event_id=3152961",
      "source": "Frankenpost",
      "scraped_at": "2026-01-02T04:04:26.264929",
      "status": "pending"
    },
    {
      "id": "html_frankenpost_-8889887645341394706",
      "title": "Madame Butterfly in Walhall „Fest–Spiele\" 1945–1950",
      "description": "Freitag,02.01.2026,10:00 Uhr",
      "location": {
        "name": "Frankenpost",
        "lat": 50.3167,
        "lon": 11.9167
      },
      "start_time": "2026-01-02T18:00:00",
      "end_time": null,
      "url": "https://event.frankenpost.de/detail.php?event_id=3153008",
      "source": "Frankenpost",
      "scraped_at": "2026-01-02T04:04:26.265472",
      "status": "pending"
    },
    {
      "id": "html_frankenpost_-6285161430613738818",
      "title": "Madame Butterfly in Walhall „Fest–Spiele\" 1945–1950",
      "description": "03.Januar10:00",
      "location": {
        "name": "Hof",
        "lat": 50.3167,
        "lon": 11.9167
      },
      "start_time": "2026-01-03T18:00:00",
      "end_time": null,
      "url": "https://event.frankenpost.de/detail.php?event_id=3153008",
      "source": "Frankenpost",
      "scraped_at": "2026-01-03T16:43:18.512518",
      "status": "pending"
    },
    {
      "id": "html_frankenpost_8059086230257668944",
      "title": "Spot(t)-Light. Richard Wagner in der zeitgenössischen Karikatur",
      "description": "Samstag,03.01.2026,10:00 Uhr",
      "location": {
        "name": "Hof",
        "lat": 50.3167,
        "lon": 11.9167
      },
      "start_time": "2026-01-03T18:00:00",
      "end_time": null,
      "url": "https://event.frankenpost.de/detail.php?event_id=3152961",
      "source": "Frankenpost",
      "scraped_at": "2026-01-03T16:43:18.513259",
      "status": "pending"
    },
    {
      "id": "html_frankenpost_8364482828306797674",
      "title": "Weihnachtlicher Stadtrundgang",
      "description": "Samstag,03.01.2026,10:30 Uhr",
      "location": {
        "name": "Hof",
        "lat": 50.3167,
        "lon": 11.9167
      },
      "start_time": "2026-01-03T18:00:00",
      "end_time": null,
      "url": "https://event.frankenpost.de/detail.php?event_id=3214209",
      "source": "Frankenpost",
      "scraped_at": "2026-01-03T16:43:18.513817",
      "status": "pending"
    },
    {
      "id": "html_frankenpost_219664318063026605",
      "title": "Führung durch die Wohnräume der Sommerresidenz der Markgräfin Caroline",
      "description": "04.Januar",
      "location": {
        "name": "Hof",
        "lat": 50.3167,
        "lon": 11.9167
      },
      "start_time": "2026-01-04T18:00:00",
      "end_time": null,
      "status": "pending",
      "source": "Frankenpost",
      "url": "https://event.frankenpost.de/detail.php?event_id=3185852",
      "category": null,
      "tags": []
    },
    {
      "id": "html_frankenpost_3042000915306191524",
      "title": "Klaviermusik aus vier Stilepochen",
      "description": "Sonntag,04.01.2026,10:00 Uhr",
      "location": {
        "name": "Hof",
        "lat": 50.3167,
        "lon": 11.9167
      },
      "start_time": "2026-01-04T18:00:00",
      "end_time": null,
      "status": "pending",
      "source": "Frankenpost",
      "url": "https://event.frankenpost.de/detail.php?event_id=3028938",
      "category": null,
      "tags": []
    },
    {
      "id": "html_frankenpost_3418267685193062465",
      "title": "Spot(t)-Light. Richard Wagner in der zeitgenössischen Karikatur",
      "description": "Sonntag,04.01.2026,10:00 Uhr",
      "location": {
        "name": "Hof",
        "lat": 50.3167,
        "lon": 11.9167
      },
      "start_time": "2026-01-04T18:00:00",
      "end_time": null,
      "status": "pending",
      "source": "Frankenpost",
      "url": "https://event.frankenpost.de/detail.php?event_id=3152961",
      "category": null,
      "tags": []
    },
    {
      "id": "html_frankenpost_3373838596801354660",
      "title": "Weihnachtlicher Stadtrundgang",
      "description": "05.Januar10:30",
      "location": {
        "name": "Hof",
        "lat": 50.3167,
        "lon": 11.9167
      },
      "start_time": "2026-01-05T18:00:00",
      "end_time": null,
      "status": "pending",
      "source": "Frankenpost",
      "url": "https://event.frankenpost.de/detail.php?event_id=3214209",
      "category": null,
      "tags": []
    },
    {
      "id": "html_frankenpost_-5936131556465191461",
      "title": "Führung: Stadtgeschichte für Kinder",
      "description": "Montag,05.01.2026,14:30 Uhr",
      "location": {
        "name": "Hof",
        "lat": 50.3167,
        "lon": 11.9167
      },
      "start_time": "2026-01-05T18:00:00",
      "end_time": null,
      "status": "pending",
      "source": "Frankenpost",
      "url": "https://event.frankenpost.de/detail.php?event_id=3152877",
      "category": null,
      "tags": []
    },
    {
      "id": "html_frankenpost_-71382608431120317",
      "title": "Churmusik am Nachmittag",
      "description": "Montag,05.01.2026,15:00 Uhr",
      "location": {
        "name": "Hof",
        "lat": 50.3167,
        "lon": 11.9167
      },
      "start_time": "2026-01-05T18:00:00",
      "end_time": null,
      "status": "pending",
      "source": "Frankenpost",
      "url": "https://event.frankenpost.de/detail.php?event_id=3028886",
      "category": null,
      "tags": []
    },
    {
      "id": "html_frankenpost_-2294901471050805624",
      "title": "Madame Butterfly in Walhall „Fest–Spiele\" 1945–1950",
      "description": "06.Januar10:00",
      "location": {
        "name": "Hof",
        "lat": 50.3167,
        "lon": 11.9167
      },
      "start_time": "2026-01-06T18:00:00",
      "end_time": null,
      "status": "pending",
      "source": "Frankenpost",
      "url": "https://event.frankenpost.de/detail.php?event_id=3153008",
      "category": null,
      "tags": []
    },
    {
      "id": "html_frankenpost_7929756233752067484",
      "title": "Spot(t)-Light. Richard Wagner in der zeitgenössischen Karikatur",
      "description": "Dienstag,06.01.2026,10:00 Uhr",
      "location": {
        "name": "Hof",
        "lat": 50.3167,
        "lon": 11.9167
      },
      "start_time": "2026-01-06T18:00:00",
      "end_time": null,
      "status": "pending",
      "source": "Frankenpost",
      "url": "https://event.frankenpost.de/detail.php?event_id=3152961",
      "category": null,
      "tags": []
    },
    {
      "id": "html_frankenpost_-3812448421094652598",
      "title": "Weihnachtlicher Stadtrundgang",
      "description": "Dienstag,06.01.2026,10:30 Uhr",
      "location": {
        "name": "Hof",
        "lat": 50.3167,
        "lon": 11.9167
      },
      "start_time": "2026-01-06T18:00:00",
      "end_time": null,
      "status": "pending",
      "source": "Frankenpost",
      "url": "https://event.frankenpost.de/detail.php?event_id=3214209",
      "category": null,
      "tags": []
    },
    {
      "id": "html_frankenpost_4178476796564011639",
      "title": "Treffpunkt für Senioren:",
      "description": "07.Januar",
      "location": {
        "name": "Hof",
        "lat": 50.3167,
        "lon": 11.9167
      },
      "start_time": "2026-01-07T18:00:00",
      "end_time": null,
      "status": "pending",
      "source": "Frankenpost",
      "url": "https://event.frankenpost.de/detail.php?event_id=3234271",
      "category": null,
      "tags": []
    },
    {
      "id": "html_frankenpost_3975465351931846877",
      "title": "Die Anmeldungen laufen zur 34. Jugendferienfreizeit (JUBI)  Hallerstein  2026 der Turnerjugend",
      "description": "Mittwoch,07.01.2026,08:00 Uhr",
      "location": {
        "name": "Hof",
        "lat": 50.3167,
        "lon": 11.9167
      },
      "start_time": "2026-01-07T18:00:00",
      "end_time": null,
      "status": "pending",
      "source": "Frankenpost",
      "url": "https://event.frankenpost.de/detail.php?event_id=3227027",
      "category": null,
      "tags": []
    },
    {
      "id": "html_frankenpost_-5822799044200726321",
      "title": "Bi 013_3 Englisch B2 für Fortgeschrittene B2",
      "description": "Mittwoch,07.01.2026,10:00 Uhr",
      "location": {
        "name": "Hof",
        "lat": 50.3167,
        "lon": 11.9167
      },
      "start_time": "2026-01-07T18:00:00",
      "end_time": null,
      "status": "pending",
      "source": "Frankenpost",
      "url": "https://event.frankenpost.de/detail.php?event_id=2582992",
      "category": null,
      "tags": []
    },
    {
      "id": "html_frankenpost_6867284990555995245",
      "title": "Führung durch die Wohnräume der Sommerresidenz der Markgräfin Caroline",
      "description": "08.Januar",
      "location": {
        "name": "Hof",
        "lat": 50.3167,
        "lon": 11.9167
      },
      "start_time": "2026-01-08T18:00:00",
      "end_time": null,
      "status": "pending",
      "source": "Frankenpost",
      "url": "https://event.frankenpost.de/detail.php?event_id=3185852",
      "category": null,
      "tags": []
    },
    {
      "id": "html_frankenpost_-6547095617177940736",
      "title": "Kunst in Bayreuth - Werke der 1940er bis 1960er Jahre - aus den Sammlungen und Stiftungen im Kunstmuseum",
      "description": "Donnerstag,08.01.2026,",
      "location": {
        "name": "Hof",
        "lat": 50.3167,
        "lon": 11.9167
      },
      "start_time": "2026-01-08T18:00:00",
      "end_time": null,
      "status": "pending",
      "source": "Frankenpost",
      "url": "https://event.frankenpost.de/detail.php?event_id=3119599",
      "category": null,
      "tags": []
    },
    {
      "id": "html_frankenpost_-3267728730594728664",
      "title": "Kunstausstellung: Stephan Klenner-Otto  - Von Jean Paul zu E.T.A. Hofmann",
      "description": "Donnerstag,08.01.2026,",
      "location": {
        "name": "Hof",
        "lat": 50.3167,
        "lon": 11.9167
      },
      "start_time": "2026-01-08T18:00:00",
      "end_time": null,
      "status": "pending",
      "source": "Frankenpost",
      "url": "https://event.frankenpost.de/detail.php?event_id=3236166",
      "category": null,
      "tags": []
    },
    {
      "id": "html_frankenpost_-4935177416888686473",
      "title": "Offene Kreativwerkstatt für Krebsbetroffene und Angehörige - Leitung: Petra Siebert",
      "description": "09.Januar09:30",
      "location": {
        "name": "Hof",
        "lat": 50.3167,
        "lon": 11.9167
      },
      "start_time": "2026-01-09T18:00:00",
      "end_time": null,
      "status": "pending",
      "source": "Frankenpost",
      "url": "https://event.frankenpost.de/detail.php?event_id=3194519",
      "category": null,
      "tags": []
    },
    {
      "id": "html_frankenpost_-2226193557103485112",
      "title": "Madame Butterfly in Walhall „Fest–Spiele\" 1945–1950",
      "description": "Freitag,09.01.2026,10:00 Uhr",
      "location": {
        "name": "Hof",
        "lat": 50.3167,
        "lon": 11.9167
      },
      "start_time": "2026-01-09T18:00:00",
      "end_time": null,
      "status": "pending",
      "source": "Frankenpost",
      "url": "https://event.frankenpost.de/detail.php?event_id=3153008",
      "category": null,
      "tags": []
    },
    {
      "id": "html_frankenpost_-6114200832501799797",
      "title": "Spot(t)-Light. Richard Wagner in der zeitgenössischen Karikatur",
      "description": "Freitag,09.01.2026,10:00 Uhr",
      "location": {
        "name": "Hof",
        "lat": 50.3167,
        "lon": 11.9167
      },
      "start_time": "2026-01-09T18:00:00",
      "end_time": null,
      "status": "pending",
      "source": "Frankenpost",
      "url": "https://event.frankenpost.de/detail.php?event_id=3152961",
      "category": null,
      "tags": []
    },
    {
      "id": "html_frankenpost_-7759954563295681415",
      "title": "Madame Butterfly in Walhall „Fest–Spiele\" 1945–1950",
      "description": "10.Januar10:00",
      "location": {
        "name": "Hof",
        "lat": 50.3167,
        "lon": 11.9167
      },
      "start_time": "2026-01-10T18:00:00",
      "end_time": null,
      "status": "pending",
      "source": "Frankenpost",
      "url": "https://event.frankenpost.de/detail.php?event_id=3153008",
      "category": null,
      "tags": []
    },
    {
      "id": "html_frankenpost_60666021519122218",
      "title": "Spot(t)-Light. Richard Wagner in der zeitgenössischen Karikatur",
      "description": "Samstag,10.01.2026,10:00 Uhr",
      "location": {
        "name": "Hof",
        "lat": 50.3167,
        "lon": 11.9167
      },
      "start_time": "2026-01-10T18:00:00",
      "end_time": null,
      "status": "pending",
      "source": "Frankenpost",
      "url": "https://event.frankenpost.de/detail.php?event_id=3152961",
      "category": null,
      "tags": []
    },
    {
      "id": "html_frankenpost_-7577927733492033132",
      "title": "Historische Stadtführung",
      "description": "Samstag,10.01.2026,10:30 Uhr",
      "location": {
        "name": "Hof",
        "lat": 50.3167,
        "lon": 11.9167
      },
      "start_time": "2026-01-10T18:00:00",
      "end_time": null,
      "status": "pending",
      "source": "Frankenpost",
      "url": "https://event.frankenpost.de/detail.php?event_id=3214213",
      "category": null,
      "tags": []
    },
    {
      "id": "html_frankenpost_2860463867127539021",
      "title": "Führung durch die Wohnräume der Sommerresidenz der Markgräfin Caroline",
      "description": "11.Januar",
      "location": {
        "name": "Hof",
        "lat": 50.3167,
        "lon": 11.9167
      },
      "start_time": "2026-01-11T18:00:00",
      "end_time": null,
      "status": "pending",
      "source": "Frankenpost",
      "url": "https://event.frankenpost.de/detail.php?event_id=3185852",
      "category": null,
      "tags": []
    },
    {
      "id": "html_frankenpost_-3343851027498800834",
      "title": "Treffpunkt für Senioren:",
      "description": "Sonntag,11.01.2026,",
      "location": {
        "name": "Hof",
        "lat": 50.3167,
        "lon": 11.9167
      },
      "start_time": "2026-01-11T18:00:00",
      "end_time": null,
      "status": "pending",
      "source": "Frankenpost",
      "url": "https://event.frankenpost.de/detail.php?event_id=3234276",
      "category": null,
      "tags": []
    },
    {
      "id": "html_frankenpost_3585673021840887885",
      "title": "WF Schwarzenbach/S.e.V. - Geführte IVV Wanderung - \"Neujahrswanderung\"",
      "description": "Sonntag,11.01.2026,09:30 Uhr",
      "location": {
        "name": "Hof",
        "lat": 50.3167,
        "lon": 11.9167
      },
      "start_time": "2026-01-11T18:00:00",
      "end_time": null,
      "status": "pending",
      "source": "Frankenpost",
      "url": "https://event.frankenpost.de/detail.php?event_id=3226272",
      "category": null,
      "tags": []
    },
    {
      "id": "html_frankenpost_8802242520196956261",
      "title": "Blutspende in Hof",
      "description": "12.Januar14:00",
      "location": {
        "name": "Hof",
        "lat": 50.3167,
        "lon": 11.9167
      },
      "start_time": "2026-01-12T18:00:00",
      "end_time": null,
      "status": "pending",
      "source": "Frankenpost",
      "url": "https://event.frankenpost.de/detail.php?event_id=3225565",
      "category": null,
      "tags": []
    },
    {
      "id": "html_frankenpost_2873443594767127465",
      "title": "Wundersame Hausaufgaben Betreuung und kreative Frei-Zeit",
      "description": "Montag,12.01.2026,14:30 Uhr",
      "location": {
        "name": "Hof",
        "lat": 50.3167,
        "lon": 11.9167
      },
      "start_time": "2026-01-12T18:00:00",
      "end_time": null,
      "status": "pending",
      "source": "Frankenpost",
      "url": "https://event.frankenpost.de/detail.php?event_id=3236554",
      "category": null,
      "tags": []
    },
    {
      "id": "html_frankenpost_-5715239139764841818",
      "title": "Churmusik am Nachmittag",
      "description": "Montag,12.01.2026,15:00 Uhr",
      "location": {
        "name": "Hof",
        "lat": 50.3167,
        "lon": 11.9167
      },
      "start_time": "2026-01-12T18:00:00",
      "end_time": null,
      "status": "pending",
      "source": "Frankenpost",
      "url": "https://event.frankenpost.de/detail.php?event_id=3028886",
      "category": null,
      "tags": []
    },
    {
      "id": "html_frankenpost_4302521329855976042",
      "title": "Schaufensterausstellung Arquitectura",
      "description": "13.Januar00:00",
      "location": {
        "name": "Hof",
        "lat": 50.3167,
        "lon": 11.9167
      },
      "start_time": "2026-01-13T18:00:00",
      "end_time": null,
      "status": "pending",
      "source": "Frankenpost",
      "url": "https://event.frankenpost.de/detail.php?event_id=3240115",
      "category": null,
      "tags": []
    },
    {
      "id": "html_frankenpost_-5204226856310146596",
      "title": "Fatigue-Sprechstunde - nach Anmeldung unter Tel. 09281-540090",
      "description": "Dienstag,13.01.2026,09:00 Uhr",
      "location": {
        "name": "Hof",
        "lat": 50.3167,
        "lon": 11.9167
      },
      "start_time": "2026-01-13T18:00:00",
      "end_time": null,
      "status": "pending",
      "source": "Frankenpost",
      "url": "https://event.frankenpost.de/detail.php?event_id=3156442",
      "category": null,
      "tags": []
    },
    {
      "id": "html_frankenpost_3204646366284117890",
      "title": "Offenes Mama wundersam Café",
      "description": "Dienstag,13.01.2026,09:00 Uhr",
      "location": {
        "name": "Hof",
        "lat": 50.3167,
        "lon": 11.9167
      },
      "start_time": "2026-01-13T18:00:00",
      "end_time": null,
      "status": "pending",
      "source": "Frankenpost",
      "url": "https://event.frankenpost.de/detail.php?event_id=3161894",
      "category": null,
      "tags": []
    },
    {
      "id": "html_frankenpost_-9064079562053131687",
      "title": "Kunstausstellung: Stephan Klenner-Otto  - Von Jean Paul zu E.T.A. Hofmann",
      "description": "Dienstag,13.01.2026,08:00 Uhr",
      "location": {
        "name": "Hof",
        "lat": 50.3167,
        "lon": 11.9167
      },
      "start_time": "2026-01-13T18:00:00",
      "end_time": null,
      "status": "pending",
      "source": "Frankenpost",
      "url": "https://event.frankenpost.de/detail.php?event_id=3236166",
      "category": null,
      "tags": []
    },
    {
      "id": "html_frankenpost_8217203280817221069",
      "title": "Schaufensterausstellung Arquitectura",
      "description": "14.Januar00:00",
      "location": {
        "name": "Hof",
        "lat": 50.3167,
        "lon": 11.9167
      },
      "start_time": "2026-01-14T18:00:00",
      "end_time": null,
      "status": "pending",
      "source": "Frankenpost",
      "url": "https://event.frankenpost.de/detail.php?event_id=3240115",
      "category": null,
      "tags": []
    },
    {
      "id": "html_frankenpost_2054260792218653141",
      "title": "Treffpunkt für Senioren:",
      "description": "Mittwoch,14.01.2026,",
      "location": {
        "name": "Hof",
        "lat": 50.3167,
        "lon": 11.9167
      },
      "start_time": "2026-01-14T18:00:00",
      "end_time": null,
      "status": "pending",
      "source": "Frankenpost",
      "url": "https://event.frankenpost.de/detail.php?event_id=3234273",
      "category": null,
      "tags": []
    },
    {
      "id": "html_frankenpost_-960507334181787057",
      "title": "Die Anmeldungen laufen zur 32. Schwimm - Gau- und Stadtmeisterschaften 2026",
      "description": "Mittwoch,14.01.2026,08:00 Uhr",
      "location": {
        "name": "Hof",
        "lat": 50.3167,
        "lon": 11.9167
      },
      "start_time": "2026-01-14T18:00:00",
      "end_time": null,
      "status": "pending",
      "source": "Frankenpost",
      "url": "https://event.frankenpost.de/detail.php?event_id=3226978",
      "category": null,
      "tags": []
    },
    {
      "id": "html_frankenpost_2685001236798047798",
      "title": "Schaufensterausstellung Arquitectura",
      "description": "15.Januar00:00",
      "location": {
        "name": "Hof",
        "lat": 50.3167,
        "lon": 11.9167
      },
      "start_time": "2026-01-15T18:00:00",
      "end_time": null,
      "status": "pending",
      "source": "Frankenpost",
      "url": "https://event.frankenpost.de/detail.php?event_id=3240115",
      "category": null,
      "tags": []
    },
    {
      "id": "html_frankenpost_3368070622015238927",
      "title": "Führung durch die Wohnräume der Sommerresidenz der Markgräfin Caroline",
      "description": "Donnerstag,15.01.2026,",
      "location": {
        "name": "Hof",
        "lat": 50.3167,
        "lon": 11.9167
      },
      "start_time": "2026-01-15T18:00:00",
      "end_time": null,
      "status": "pending",
      "source": "Frankenpost",
      "url": "https://event.frankenpost.de/detail.php?event_id=3185852",
      "category": null,
      "tags": []
    },
    {
      "id": "html_frankenpost_4240821882790170228",
      "title": "Kunst in Bayreuth - Werke der 1940er bis 1960er Jahre - aus den Sammlungen und Stiftungen im Kunstmuseum",
      "description": "Donnerstag,15.01.2026,",
      "location": {
        "name": "Hof",
        "lat": 50.3167,
        "lon": 11.9167
      },
      "start_time": "2026-01-15T18:00:00",
      "end_time": null,
      "status": "pending",
      "source": "Frankenpost",
      "url": "https://event.frankenpost.de/detail.php?event_id=3119599",
      "category": null,
      "tags": []
    },
    {
      "id": "html_frankenpost_6690793164460313214",
      "title": "Schaufensterausstellung Arquitectura",
      "description": "16.Januar00:00",
      "location": {
        "name": "Hof",
        "lat": 50.3167,
        "lon": 11.9167
      },
      "start_time": "2026-01-16T18:00:00",
      "end_time": null,
      "status": "pending",
      "source": "Frankenpost",
      "url": "https://event.frankenpost.de/detail.php?event_id=3240115",
      "category": "default",
      "tags": []
    },
    {
      "id": "html_frankenpost_-2155491189281099303",
      "title": "Kunstausstellung: Stephan Klenner-Otto  - Von Jean Paul zu E.T.A. Hofmann",
      "description": "Freitag,16.01.2026,08:00 Uhr",
      "location": {
        "name": "Hof",
        "lat": 50.3167,
        "lon": 11.9167
      },
      "start_time": "2026-01-16T18:00:00",
      "end_time": null,
      "status": "pending",
      "source": "Frankenpost",
      "url": "https://event.frankenpost.de/detail.php?event_id=3236166",
      "category": "default",
      "tags": []
    },
    {
      "id": "html_frankenpost_3915312680127180278",
      "title": "Madame Butterfly in Walhall „Fest–Spiele\" 1945–1950",
      "description": "Freitag,16.01.2026,10:00 Uhr",
      "location": {
        "name": "Hof",
        "lat": 50.3167,
        "lon": 11.9167
      },
      "start_time": "2026-01-16T18:00:00",
      "end_time": null,
      "status": "pending",
      "source": "Frankenpost",
      "url": "https://event.frankenpost.de/detail.php?event_id=3153008",
      "category": "default",
      "tags": []
    },
    {
      "id": "html_frankenpost_3158952564487606433",
      "title": "Spot(t)-Light. Richard Wagner in der zeitgenössischen Karikatur",
      "description": "Freitag,16.01.2026,10:00 Uhr",
      "location": {
        "name": "Hof",
        "lat": 50.3167,
        "lon": 11.9167
      },
      "start_time": "2026-01-16T18:00:00",
      "end_time": null,
      "status": "pending",
      "source": "Frankenpost",
      "url": "https://event.frankenpost.de/detail.php?event_id=3152961",
      "category": "default",
      "tags": []
    },
    {
      "id": "html_frankenpost_492da05adac14ea5",
      "title": "Seniorentreffen \"Kumm rei\"",
      "description": "Jetzt ganz einfach dabei sein.",
      "location": {
        "name": "ATSV-Heim am Eisteich",
        "lat": 50.3167,
        "lon": 11.9167
      },
      "start_time": "2026-01-16T18:00:00",
      "end_time": null,
      "status": "pending",
      "source": "Frankenpost",
      "url": "https://event.frankenpost.de/detail.php?event_id=3225510",
      "category": "default",
      "tags": []
    },
    {
      "id": "html_frankenpost_a3bd0dbcc7e70e56",
      "title": "Churmusik am Nachmittag",
      "description": "Jetzt ganz einfach dabei sein.",
      "location": {
        "name": "KunstWandelhalle",
        "lat": 50.3167,
        "lon": 11.9167
      },
      "start_time": "2026-01-16T18:00:00",
      "end_time": null,
      "status": "pending",
      "source": "Frankenpost",
      "url": "https://event.frankenpost.de/detail.php?event_id=2110527",
      "category": "default",
      "tags": []
    },
    {
      "id": "html_frankenpost_0d452882916357db",
      "title": "Tag der offenen Tür",
      "description": "Jetzt ganz einfach dabei sein.",
      "location": {
        "name": "BRK-Kindertagesstätte Lindenstraße",
        "lat": 50.3167,
        "lon": 11.9167
      },
      "start_time": "2026-01-16T18:00:00",
      "end_time": null,
      "status": "pending",
      "source": "Frankenpost",
      "url": "https://event.frankenpost.de/detail.php?event_id=3239289",
      "category": "default",
      "tags": []
    },
    {
      "id": "html_frankenpost_bf40c9d52b56292c",
      "title": "Schnupperkegeln für Kids ab 9 bis 16 Jahre",
      "description": "Jetzt ganz einfach dabei sein.",
      "location": {
        "name": "Schützengilde Bayreuth - Kegelbahnanlage",
        "lat": 49.944,
        "lon": 11.576
      },
      "start_time": "2026-01-16T18:00:00",
      "end_time": null,
      "status": "pending",
      "source": "Frankenpost",
      "url": "https://event.frankenpost.de/detail.php?event_id=3239530",
      "category": "default",
      "tags": []
    },
    {
      "id": "html_frankenpost_a689331079fc1eea",
      "title": "Eisdisco, 14 bis 16 Uhr, öffentlicher Lauf",
      "description": "Jetzt ganz einfach dabei sein.",
      "location": {
        "name": "Eisteich",
        "lat": 50.3167,
        "lon": 11.9167
      },
      "start_time": "2026-01-16T18:00:00",
      "end_time": null,
      "status": "pending",
      "source": "Frankenpost",
      "url": "https://event.frankenpost.de/detail.php?event_id=2309743",
      "category": "default",
      "tags": []
    },
    {
      "id": "html_frankenpost_d7c1dc9975b4e555",
      "title": "Stammtisch Münchberg der Offenen Hilfen der Lebenshilfe Hof",
      "description": "Jetzt ganz einfach dabei sein.",
      "location": {
        "name": "Hopfenhäusla",
        "lat": 50.3167,
        "lon": 11.9167
      },
      "start_time": "2026-01-16T18:00:00",
      "end_time": null,
      "status": "pending",
      "source": "Frankenpost",
      "url": "https://event.frankenpost.de/detail.php?event_id=3239609",
      "category": "default",
      "tags": []
    },
    {
      "id": "html_frankenpost_43188e25560b5ffc",
      "title": "Vernissage zur Femeinschaftsausstellung \"Heimat III\" des Kunstvereins Hochfranken Selb e.V.",
      "description": "Jetzt ganz einfach dabei sein.",
      "location": {
        "name": "MAKkultur",
        "lat": 50.3167,
        "lon": 11.9167
      },
      "start_time": "2026-01-16T18:00:00",
      "end_time": null,
      "status": "pending",
      "source": "Frankenpost",
      "url": "https://event.frankenpost.de/detail.php?event_id=3229653",
      "category": "default",
      "tags": []
    },
    {
      "id": "html_frankenpost_6deee683e63e291a",
      "title": "HEIMAT 3 Ausstellung mit Arbeiten der Mitglieds Künstler des Kunstverein Hochfranken Selb e.V.",
      "description": "Jetzt ganz einfach dabei sein.",
      "location": {
        "name": "MAKkultur",
        "lat": 50.3167,
        "lon": 11.9167
      },
      "start_time": "2026-01-16T18:00:00",
      "end_time": null,
      "status": "pending",
      "source": "Frankenpost",
      "url": "https://event.frankenpost.de/detail.php?event_id=3237570",
      "category": "default",
      "tags": []
    },
    {
      "id": "html_frankenpost_e81e06e60fb22263",
      "title": "Vorstellung der Kandidaten der CSU Konradsreuth für die Kommunalwahl 2026",
      "description": "Jetzt ganz einfach dabei sein.",
      "location": {
        "name": "FCK-Sportheim",
        "lat": 50.3167,
        "lon": 11.9167
      },
      "start_time": "2026-01-16T18:00:00",
      "end_time": null,
      "status": "pending",
      "source": "Frankenpost",
      "url": "https://event.frankenpost.de/detail.php?event_id=3237872",
      "category": "default",
      "tags": []
    },
    {
      "id": "html_frankenpost_a772ff2e6676fc8b",
      "title": "Jahreshauptversammlung",
      "description": "Jetzt ganz einfach dabei sein.",
      "location": {
        "name": "Siedlerhaisla am Hopfengarten",
        "lat": 50.3167,
        "lon": 11.9167
      },
      "start_time": "2026-01-16T18:00:00",
      "end_time": null,
      "status": "pending",
      "source": "Frankenpost",
      "url": "https://event.frankenpost.de/detail.php?event_id=3230990",
      "category": "default",
      "tags": []
    },
    {
      "id": "html_frankenpost_12bf531be7be6ed7",
      "title": "Zammhoggn & Anpacken: SPD Helmbrechts lädt zum Gespräch",
      "description": "Jetzt ganz einfach dabei sein.",
      "location": {
        "name": "Sportheim",
        "lat": 50.3167,
        "lon": 11.9167
      },
      "start_time": "2026-01-16T18:00:00",
      "end_time": null,
      "status": "pending",
      "source": "Frankenpost",
      "url": "https://event.frankenpost.de/detail.php?event_id=3235119",
      "category": "default",
      "tags": []
    },
    {
      "id": "html_frankenpost_7e00d4102c2b6ad6",
      "title": "Wahlveranstaltung der Unabhängigen Liste Stammbach",
      "description": "Jetzt ganz einfach dabei sein.",
      "location": {
        "name": "Feuerwehrhaus Querenbach",
        "lat": 50.3167,
        "lon": 11.9167
      },
      "start_time": "2026-01-16T18:00:00",
      "end_time": null,
      "status": "pending",
      "source": "Frankenpost",
      "url": "https://event.frankenpost.de/detail.php?event_id=3240549",
      "category": "default",
      "tags": []
    },
    {
      "id": "html_frankenpost_1e4eda5b6b9e752f",
      "title": "Herzerwärmergeschichten und Wortgeschenke",
      "description": "Jetzt ganz einfach dabei sein.",
      "location": {
        "name": "Meister Bär Hotel",
        "lat": 50.3167,
        "lon": 11.9167
      },
      "start_time": "2026-01-16T18:00:00",
      "end_time": null,
      "status": "pending",
      "source": "Frankenpost",
      "url": "https://event.frankenpost.de/detail.php?event_id=3239269",
      "category": "default",
      "tags": []
    },
    {
      "id": "html_frankenpost_e6d968c6536d9900",
      "title": "Die CSU Münchberg vor Ort",
      "description": "Jetzt ganz einfach dabei sein.",
      "location": {
        "name": "Kuhstall",
        "lat": 50.3167,
        "lon": 11.9167
      },
      "start_time": "2026-01-16T18:00:00",
      "end_time": null,
      "status": "pending",
      "source": "Frankenpost",
      "url": "https://event.frankenpost.de/detail.php?event_id=3236182",
      "category": "default",
      "tags": []
    },
    {
      "id": "html_frankenpost_449beeb898807da1",
      "title": "Niedecken: Zwischen Start & Ziel",
      "description": "Jetzt ganz einfach dabei sein.",
      "location": {
        "name": "König Albert Theater",
        "lat": 50.3167,
        "lon": 11.9167
      },
      "start_time": "2026-01-16T18:00:00",
      "end_time": null,
      "status": "pending",
      "source": "Frankenpost",
      "url": "https://event.frankenpost.de/detail.php?event_id=3107748",
      "category": "arts",
      "tags": []
    }
  ],
  "last_scraped": "2026-01-16T19:19:42.370055"
}